{
  "artifactSchemaVersion": 1,
  "artifactSha256": "17006d0e045fdc42547ca0b0dd058eb67532e6967a1136156c51e4cb4c00de09",
  "comparisonSha256": "92d8878c37a2c39a25f5d5241e54b1acaff7fbc2012d975d4b659f6fb72db041",
  "datasetSha256": "e82005c8ca78b7966f24e1faaf2a2b161262f1e774dc813e0c2d0743280cb046",
  "datasetVersion": "reactorfront-synthetic-documents-v1",
  "evaluationPolicySha256": "e3431c6d4e9094b8bd88b77a4ba4abc860641d7f83eaf71a5ee71c8f46bae332",
  "evaluationPolicyVersion": "document-classification-evaluation-v1",
  "evaluationReportSha256": "83493ba1053c6252651e64a9afdb424385eb527c1c2ca94cbc99ade0d610d861",
  "evidence": {
    "candidateBuildPath": "apps/ml/evaluation/candidate-build-v1.json",
    "candidateComparisonPath": "apps/ml/evaluation/candidate-comparison-v1.json",
    "candidateComparisonSchemaPath": "apps/ml/evaluation/candidate-comparison-v1.schema.json",
    "candidateReportPath": "apps/ml/evaluation/candidate-report-v1.json",
    "championReportPath": "apps/ml/evaluation/champion-baseline-v1.json",
    "championTrainingDataPath": "apps/ml/data/training.json",
    "datasetSnapshotPath": "apps/ml/evaluation/corpus/v1/snapshot.json",
    "dependencyLockPath": "apps/ml/uv.lock",
    "evaluationPolicyPath": "apps/ml/evaluation/policy-v1.json",
    "evaluationReportSchemaPath": "apps/ml/evaluation/evaluation-report-v1.schema.json"
  },
  "modelName": "reactorfront-document-type",
  "modelVersion": "document-type-candidate-v1",
  "pipelineVersion": "pytorch-multinomial-naive-bayes-linear-v1",
  "preprocessingVersion": "nfkc-ascii-alphanumeric-bow-v1",
  "schemaVersion": "promoted-model-v1",
  "selectionType": "candidate-promotion",
  "taskOntology": [
    "invoice",
    "report"
  ]
}
